{
  "skill": "qveris-supply-chain-catalyst-radar",
  "source_record": {
    "original_repository": "MarketBot",
    "github_url": "https://github.com/EthanAlgoX/MarketBot",
    "license": "MIT",
    "adapted_components": ["catalyst-tracker", "logic-chain-visualizer", "thesis-tracker"],
    "upstream_commit": "4faa7fd7406a40ce8081b6a49de5cad08a545c64",
    "evaluated_at": "2026-07-24"
  },
  "controls": {
    "dry_run": true,
    "max_calls": 0,
    "max_age": {
      "identity": "P30D",
      "supply_chain": "P365D",
      "jobs": "P120D",
      "patents": "P365D",
      "contracts": "P365D",
      "filings": "P180D",
      "news": "P7D",
      "shipping": "PT6H"
    },
    "budget_note": "Static dry-run example; no runtime observation is claimed."
  },
  "analysis": {
    "workflow": "company_radar",
    "summary": "Static structure-only example; all catalyst conclusions remain unsupported.",
    "evidence_status": "limited",
    "as_of": null,
    "issuer": "AAPL",
    "window": { "start": "2026-04-25", "end": "2026-07-24", "timezone": "UTC" },
    "planned_calls": [
      "qveris_finance.ref_security_master",
      "qveris_finance.alt_supply_chain",
      "qveris_finance.alt_job_postings",
      "qveris_finance.alt_patents",
      "qveris_finance.alt_govt_contracts",
      "qveris_finance.filings_regulatory_metadata",
      "qveris_finance.news_fin_tagged"
    ],
    "sections": ["issuer_identity", "supply_chain_relationships", "job_postings", "patent_activity", "government_contracts", "regulatory_filings", "qualitative_news_context"],
    "change_assessment": {
      "status": "unsupported",
      "reason": "No independently aligned baseline/current comparison was observed."
    },
    "shipping_company_link_status": "not_requested",
    "interpretation_limits": ["alternative_data_is_observational_not_causal", "single_window_does_not_prove_change"],
    "rejections": [],
    "evidence": []
  },
  "risk_notes": [
    "Alternative-data records may be incomplete or delayed and do not by themselves establish financial impact."
  ],
  "missing_fields": ["issuer_identity", "supply_chain_relationships", "job_postings", "patent_activity", "government_contracts", "regulatory_filings", "qualitative_news_context"],
  "data_quality": {
    "status": "limited",
    "warnings": ["dry_run_no_transport"],
    "stale_fields": [],
    "out_of_window_events": [],
    "suppressed_fields": ["target_price", "investment_recommendation", "directional_forecast", "causal_claim_without_corroboration", "unverified_company_vessel_link"]
  },
  "observed_call_count": 0,
  "qveris_trace": [],
  "disclaimer": "Not investment advice.",
  "suppressed_fields": ["target_price", "investment_recommendation", "directional_forecast", "causal_claim_without_corroboration", "unverified_company_vessel_link"]
}
