{
  "skill": "qveris-supply-chain-catalyst-radar",
  "source_record": {
    "original_repository": "MarketBot",
    "github_url": "https://github.com/EthanAlgoX/MarketBot",
    "license": "MIT",
    "adapted_components": ["catalyst-tracker", "logic-chain-visualizer", "thesis-tracker"],
    "upstream_commit": "4faa7fd7406a40ce8081b6a49de5cad08a545c64",
    "evaluated_at": "2026-07-24"
  },
  "controls": {
    "dry_run": true,
    "max_calls": 0,
    "max_age": {
      "identity": "P30D",
      "supply_chain": "P365D",
      "jobs": "P120D",
      "patents": "P365D",
      "contracts": "P365D",
      "filings": "P180D",
      "news": "P7D",
      "shipping": "PT6H"
    },
    "budget_note": "Static fallback example; no runtime observation is claimed."
  },
  "analysis": {
    "workflow": "shipping_watch",
    "summary": "Vessel and company linkage is unavailable, so issuer impact is unsupported.",
    "evidence_status": "partial",
    "as_of": null,
    "issuer": "AAPL",
    "window": { "start": "2026-04-25", "end": "2026-07-24", "timezone": "UTC" },
    "planned_calls": ["qveris_finance.ref_security_master", "qveris_finance.alt_supply_chain", "qveris_finance.alt_shipping_ais"],
    "sections": ["issuer_identity", "supply_chain_relationships", "shipping_ais_observation"],
    "change_assessment": {
      "status": "unsupported",
      "reason": "No independently aligned baseline/current comparison was observed."
    },
    "shipping_company_link_status": "unverified",
    "interpretation_limits": ["shipping_observation_requires_independent_company_link"],
    "rejections": [],
    "evidence": []
  },
  "risk_notes": ["A vessel observation does not prove issuer ownership, cargo, delivery, delay, or financial impact."],
  "missing_fields": ["issuer_identity", "supply_chain_relationships", "shipping_ais_observation", "company_vessel_link"],
  "data_quality": {
    "status": "partial",
    "warnings": ["static_fallback_no_transport", "company_vessel_link_unverified"],
    "stale_fields": [],
    "out_of_window_events": [],
    "suppressed_fields": ["target_price", "investment_recommendation", "directional_forecast", "causal_claim_without_corroboration", "unverified_company_vessel_link"]
  },
  "observed_call_count": 0,
  "qveris_trace": [],
  "disclaimer": "Not investment advice.",
  "suppressed_fields": ["target_price", "investment_recommendation", "directional_forecast", "causal_claim_without_corroboration", "unverified_company_vessel_link"]
}
